slug,name,category,province,seo_title,seo_description,channel_description,embed_type,embed_source,fallback_url,featured
vallevision,Vallevisión,regional,La Vega/El Cibao,"Vallevisión en Vivo | TV de La Vega/El Cibao, RD - DR TV","Ve Vallevisión en vivo, la señal de La Vega/El Cibao en República Dominicana. Transmisión en vivo, sin cortes, directo desde República Dominicana.","Vallevisión es la señal local de La Vega/El Cibao, llevando noticias, comunidad y programación regional a la pantalla. Para quienes son de La Vega/El Cibao —dentro o fuera del país— DR TV te conecta con tu canal en vivo, directo desde casa.",youtube,youtube.com/embed/1cO8jTWMj6c,https://vallevision.com.do/,false
azua-tv,Azua TV,regional,Azua,"Azua TV en Vivo | TV de la provincia, RD - DR TV","Ve Azua TV en vivo, la señal comunitaria de esta provincia dominicana. Transmisión en vivo, sin cortes, directo desde República Dominicana.","Azua TV es la señal local de Azua, llevando noticias, comunidad y programación regional a la pantalla. Para quienes son de esta comunidad —dentro o fuera del país— DR TV te conecta con tu canal en vivo, directo desde casa.",facebook,https://www.facebook.com/azuatv3,https://www.facebook.com/azuatv3,false
beller-vision-canal-22,Beller Visión Canal 22,regional,Dajabón,"Beller Visión Canal 22 en Vivo | TV de la provincia, RD - DR TV","Ve Beller Visión Canal 22 en vivo, la señal comunitaria de esta provincia dominicana. Transmisión en vivo, sin cortes, directo desde República Dominicana.","Beller Visión Canal 22 es la señal local de Dajabón, llevando noticias, comunidad y programación regional a la pantalla. Para quienes son de esta comunidad —dentro o fuera del país— DR TV te conecta con tu canal en vivo, directo desde casa.",facebook,http://es-la.facebook.com/people/Beller-Vision-CANAL-22/100028375400328/,http://es-la.facebook.com/people/Beller-Vision-CANAL-22/100028375400328/,false
cotui-tv,Cotuí TV,regional,Cotuí,"Cotuí TV en Vivo | TV de la provincia HD 4K, RD - DR TV","Ve Cotuí TV en vivo, la señal comunitaria en HD de Cotuí. Transmisión en vivo, sin cortes, directo desde República Dominicana.","Cotuí TV es la señal local de Cotuí, en Sánchez Ramírez, llevando noticias, comunidad y programación regional a la pantalla. Para quienes son de Cotuí —dentro o fuera del país— DR TV te conecta con tu canal en vivo, directo desde casa.",facebook,https://www.facebook.com/cotuitv/,https://www.facebook.com/cotuitv/,false
faro-vision-digital,Faro Visión Digital,regional,Río San Juan,"Faro Visión Digital en Vivo | TV de la provincia, RD - DR TV","Ve Faro Visión Digital en vivo, la señal comunitaria de esta provincia dominicana. Transmisión en vivo, sin cortes, directo desde República Dominicana.","Faro Visión Digital es la señal local de Río San Juan, llevando noticias, comunidad y programación regional a la pantalla. Para quienes son de esta comunidad —dentro o fuera del país— DR TV te conecta con tu canal en vivo, directo desde casa.",facebook,https://www.facebook.com/farovision/,https://www.facebook.com/farovision/,false
santa-cruz-tv-8,Santa Cruz TV 8,regional,El Seibo,"Santa Cruz TV 8 en Vivo | TV de la provincia, RD - DR TV","Ve Santa Cruz TV 8 en vivo, la señal comunitaria de esta provincia dominicana. Transmisión en vivo, sin cortes, directo desde República Dominicana.","Santa Cruz TV 8 es la señal local de El Seibo, llevando noticias, comunidad y programación regional a la pantalla. Para quienes son de esta comunidad —dentro o fuera del país— DR TV te conecta con tu canal en vivo, directo desde casa.",facebook,https://www.facebook.com/SantaCruzTvCanal8LaMejorImagen/,https://www.facebook.com/SantaCruzTvCanal8LaMejorImagen/,false
televida-canal-41,Televida Canal 41,christian,,Televida Canal 41 en Vivo | Canal Cristiano Dominicano - DR TV,"Sintoniza Televida Canal 41 en vivo, programación cristiana dominicana. Transmisión en vivo, sin cortes, directo desde República Dominicana.","Televida Canal 41 transmite programación cristiana en vivo desde República Dominicana con programación católica: alabanza, mensajes y contenido familiar. Sintonízalo en cualquier momento del día directamente en DR TV.",facebook,https://es-la.facebook.com/Televida/,https://es-la.facebook.com/Televida/,false
telenord-canal-10,Telenord Canal 10,national-news,,Telenord Canal 10 en Vivo | DR TV,"Mira Telenord Canal 10 en vivo online gratis, 24 horas al día. Transmisión en vivo, sin cortes, directo desde República Dominicana.","Telenord Canal 10 es uno de los canales de referencia como parte de la red Telenord, con programación de noticias, opinión y actualidad dominicana. En DR TV puedes seguir su transmisión en vivo directamente, sin salir de la página, ya sea que estés en la isla o formes parte de la diáspora dominicana en el exterior.",youtube,youtube.com/channel/UCCfVdftz7iAug_IYreoJgHw,https://telenord.com.do/index.php?option=com_content&view=category&layout=blog&id=10&Itemid=116,false
tvo-39,TVO 39,regional,La Romana,"TVO 39 en Vivo | TV de La Romana, RD - DR TV","Ve TVO 39 en vivo, la señal de La Romana en República Dominicana. Transmisión en vivo, sin cortes, directo desde República Dominicana.","TVO 39 es la señal local de La Romana, llevando noticias, comunidad y programación regional a la pantalla. Para quienes son de La Romana —dentro o fuera del país— DR TV te conecta con tu canal en vivo, directo desde casa.",hls,https://videoserver.tmcreativos.com:19360/gkemzxrrmr/gkemzxrrmr.m3u8,https://tvo.com.do/,false
vision-ndv,Visión NDV,regional,Santiago,"Visión NDV en Vivo | TV de Santiago, RD - DR TV","Ve Visión NDV en vivo, la señal comunitaria de Santiago. Transmisión en vivo, sin cortes, directo desde República Dominicana.","Visión NDV es la señal local de Santiago, llevando noticias, comunidad y programación regional a la pantalla. Para quienes son de Santiago —dentro o fuera del país— DR TV te conecta con tu canal en vivo, directo desde casa.",hls,https://soportedvb.click:3891/live/visionndvlive.m3u8,https://www.visionndv.net/,false
tv-fe,TV FE,christian,,TV FE en Vivo | Canal Cristiano Dominicano - DR TV,"Sintoniza TV FE en vivo, programación cristiana dominicana. Transmisión en vivo, sin cortes, directo desde República Dominicana.","TV FE transmite programación cristiana en vivo desde República Dominicana con himnos, alabanza y mensajes cristianos: alabanza, mensajes y contenido familiar. Sintonízalo en cualquier momento del día directamente en DR TV.",hls,https://vdopanel.jlahozconsulting.com/p/3662/hybrid/play.m3u8,https://www.tvfe.tv/index.html,false
cielo-tv,Cielo TV,christian,,Cielo TV en Vivo | Canal Cristiano Dominicano - DR TV,"Sintoniza Cielo TV en vivo, programación cristiana dominicana. Transmisión en vivo, sin cortes, directo desde República Dominicana.","Cielo TV transmite programación cristiana en vivo desde República Dominicana con programación cristiana familiar: alabanza, mensajes y contenido familiar. Sintonízalo en cualquier momento del día directamente en DR TV.",iframe,https://streaming.servervideo.net/VideoPlayer/cielotv?autoplay=1,https://cielotv.do/,false
aliento-vision-tv,Aliento Visión TV,christian,,Aliento Visión TV en Vivo | Canal Cristiano Dominicano - DR TV,"Sintoniza Aliento Visión TV en vivo, programación cristiana dominicana. Transmisión en vivo, sin cortes, directo desde República Dominicana.","Aliento Visión TV transmite programación cristiana en vivo desde Nueva York para la diáspora dominicana con contenido cristiano: alabanza, mensajes y contenido familiar. Sintonízalo en cualquier momento del día directamente en DR TV.",youtube,youtube.com/embed/3xsTI98NSKw,https://www.alientovision.com/,false
acontecer-del-cibao-tv,Acontecer del Cibao TV,regional,Cibao,Acontecer del Cibao TV en Vivo | DR TV,"Ve Acontecer del Cibao TV en vivo, la señal digital del Cibao. Transmisión en vivo, sin cortes, directo desde República...","Acontecer del Cibao TV es la señal local del Cibao, llevando noticias, comunidad y programación regional a la pantalla. Para quienes son del Cibao —dentro o fuera del país— DR TV te conecta con tu canal en vivo, directo desde casa.",hls,https://gplayer.hiesoft.net/player.php?url=https://stream.hiesoft.net/memfs/a625d423-134a-47c2-b4d6-93c4dfdae4d4_output_0.m3u8?session=ev5Xh7sYqgNUYun5PqnQSi,https://www.acontecerdelcibao.com/p/tv.html,false
ztv-digital,ZTV Digital,entertainment,,ZTV Digital en Vivo Online | TV Dominicana Gratis - DR TV,"Disfruta ZTV Digital en vivo online, entretenimiento dominicano gratis. Transmisión en vivo, sin cortes, directo desde República Dominicana.","ZTV Digital transmite entretenimiento, variedades y programación familiar en vivo desde Santo Domingo como brazo televisivo de Z101. Una señal pensada para acompañarte todo el día, disponible en DR TV sin necesidad de buscar en otro sitio.",youtube,youtube.com/embed/strhKu8XiI8,https://z101digital.com/ztv/,false
tv-ola-44-hd,TV Ola 44 HD,regional,Región Este,"TV Ola 44 HD en Vivo | TV de la región este de la República Dominicana, RD - DR TV","Ve TV Ola 44 HD en vivo, la señal UHF de la región este de la República Dominicana. Transmisión en vivo, sin cortes, directo desde República Dominicana.","TV Ola 44 HD es la señal local de la región este de la República Dominicana, llevando noticias, comunidad y programación regional a la pantalla. Para quienes son del este dominicano —dentro o fuera del país— DR TV te conecta con tu canal en vivo, directo desde casa.",youtube,youtube.com/channel/UC-vonuM13POcYWAQx70OAIQ,https://teleola44hd.com/,false
hilando-fino-tv,Hilando Fino TV,entertainment,,Hilando Fino TV en Vivo Online | TV Dominicana Gratis - DR TV,"Disfruta Hilando Fino TV en vivo online, entretenimiento dominicano gratis. Transmisión en vivo, sin cortes, directo desde República Dominicana.","Hilando Fino TV transmite entretenimiento, variedades y programación familiar en vivo desde República Dominicana con programación familiar. Una señal pensada para acompañarte todo el día, disponible en DR TV sin necesidad de buscar en otro sitio.",youtube,youtube.com/channel/UCUPkqvKKBbtkuGKAVjW0uyw,https://www.hilandofinotv.com/,false
canalda-hd,Canalda HD,entertainment,,Canalda HD en Vivo Online | TV Dominicana Gratis - DR TV,"Disfruta Canalda HD en vivo online, entretenimiento dominicano gratis. Transmisión en vivo, sin cortes, directo desde República Dominicana.","Canalda HD transmite entretenimiento, variedades y programación familiar en vivo desde República Dominicana con música nacional. Una señal pensada para acompañarte todo el día, disponible en DR TV sin necesidad de buscar en otro sitio.",iframe,https://canalda.rgradio.net/hybrid-stream-video-widget/canalda,https://canaldahd.com/,false
bani-vision,Baní Visión,national-news,,Baní Visión en Vivo | TV de Baní y Peravia - DR TV,"Baní Visión en vivo: la señal televisiva de Baní y la provincia Peravia, en el sur de la República Dominicana.","Baní Visión es la señal televisiva de referencia para la ciudad de Baní y la provincia Peravia, en el suroeste de la República Dominicana. Baní es una de las ciudades con más identidad cultural del país —cuna de figuras históricas de la vida política dominicana, tierra del mango banilejo y de las Salinas de Puerto Hermoso—, y su canal local funciona como una de las voces principales para seguir el pulso diario de la comunidad.  La programación combina informativos locales sobre lo que pasa en la provincia, cobertura de actos comunitarios, actividades culturales, deportes locales, entrevistas con figuras de la vida pública banileja, contenido religioso, programas musicales y espacios de opinión sobre lo que ocurre en el ayuntamiento y en los barrios. Es la vía natural para enterarse de las fiestas patronales de Nuestra Señora de Regla, de los actos oficiales de la provincia y de las noticias que a menudo no llegan a los canales de alcance nacional en Santo Domingo.  Para la diáspora banileja —una de las más numerosas y organizadas dentro de la comunidad dominicana en el exterior, con presencia especialmente fuerte en Nueva York, Boston y Rhode Island— Baní Visión es una ventana directa al pueblo. Ver la señal en vivo desde el extranjero es como asomarse a casa: las mismas voces, los mismos rostros, las mismas noticias de la calle. En DR TV puedes sintonizar Baní Visión desde esta misma página; es uno de los canales destacados de nuestro directorio por su valor para la diáspora banileja y peravieja.",youtube,youtube.com/@Banivision,https://www.banivision.com/,true
digital-809-tv,Digital 809 TV,entertainment,,Digital 809 TV en Vivo Online | TV Dominicana Gratis - DR TV,"Disfruta Digital 809 TV en vivo online, entretenimiento dominicano gratis. Transmisión en vivo, sin cortes, directo desde República Dominicana.","Digital 809 TV transmite entretenimiento, variedades y programación familiar en vivo desde República Dominicana con videos musicales. Una señal pensada para acompañarte todo el día, disponible en DR TV sin necesidad de buscar en otro sitio.",hls,https://stream.inliveserver.com:19360/8146/8146.m3u8,https://digital809tv.com,false
valle-nuevo-tv,Valle Nuevo TV,regional,Constanza La Vega,"Valle Nuevo TV en Vivo | TV de Constanza La Vega, RD - DR TV","Ve Valle Nuevo TV en vivo, la señal de Constanza La Vega en República Dominicana. Transmisión en vivo, sin cortes, directo desde República Dominicana.","Valle Nuevo TV es la señal local de Constanza La Vega, llevando noticias, comunidad y programación regional a la pantalla. Para quienes son de Constanza La Vega —dentro o fuera del país— DR TV te conecta con tu canal en vivo, directo desde casa.",youtube,youtube.com/@ValleNuevoTV,https://vallenuevotv.com/,false
el-sol-network-tv,EL Sol Network TV,entertainment,,EL Sol Network TV en Vivo Online | TV Dominicana Gratis - DR TV,"Disfruta EL Sol Network TV en vivo online, entretenimiento dominicano gratis. Transmisión en vivo, sin cortes, directo desde República Dominicana.","EL Sol Network TV transmite entretenimiento, variedades y programación familiar en vivo desde República Dominicana. Una señal pensada para acompañarte todo el día, disponible en DR TV sin necesidad de buscar en otro sitio.",youtube,youtube.com/embed/PCAxivrM4vIu0026t,https://elsolnetworktv.com/,false
tni-canal-51,TNI Canal 51,regional,República Dominicana,TNI Canal 51 en Vivo | Red TNI República Dominicana - DR TV,"Ve TNI Canal 51 en vivo, la señal de la red TNI en República Dominicana. Transmisión en vivo, sin cortes, directo desde República Dominicana.","TNI Canal 51 es la señal televisiva de la red TNI, llevando noticias, comunidad y programación regional a la pantalla. Para quienes son de esta comunidad —dentro o fuera del país— DR TV te conecta con tu canal en vivo, directo desde casa.",youtube,youtu.be/0yyFduNDg4U,https://tni51.com/,false
camu-tv,Camú TV,regional,La Vega,"Camú TV en Vivo | TV de La Vega, RD - DR TV","Ve Camú TV en vivo, la señal digital de La Vega. Transmisión en vivo, sin cortes, directo desde República Dominicana.","Camú TV es la señal local de La Vega, llevando noticias, comunidad y programación regional a la pantalla. Para quienes son de La Vega —dentro o fuera del país— DR TV te conecta con tu canal en vivo, directo desde casa.",hls,https://tv.ycrnet.uk/camutv.m3u8,https://www.camutv.net/,false
yuna-vision,Yuna Visión,regional,Monseñor Nouel,"Yuna Visión en Vivo | TV de Monseñor Nouel, RD - DR TV","Ve Yuna Visión en vivo, la señal de Monseñor Nouel en República Dominicana. Transmisión en vivo, sin cortes, directo desde República Dominicana.","Yuna Visión es la señal local de Monseñor Nouel, llevando noticias, comunidad y programación regional a la pantalla. Para quienes son de Monseñor Nouel —dentro o fuera del país— DR TV te conecta con tu canal en vivo, directo desde casa.",hls,https://tele-stream.telecasa.net/live/st1/yunavision-hd/index.m3u8,https://www.yunavision.com/,false
vision-global-tv,Visión Global TV,entertainment,,Visión Global TV en Vivo Online | TV Dominicana Gratis - DR TV,"Disfruta Visión Global TV en vivo online, entretenimiento dominicano gratis. Transmisión en vivo, sin cortes, directo desde República Dominicana.","Visión Global TV transmite entretenimiento, variedades y programación familiar en vivo desde República Dominicana con humor, cine y música. Una señal pensada para acompañarte todo el día, disponible en DR TV sin necesidad de buscar en otro sitio.",hls,https://vdopanel.jlahozconsulting.com:3407/hybrid/play.m3u8,https://visionglobaltv.net/,false
la-voz-de-maria,La Voz de María,christian,,La Voz de María en Vivo | Canal Cristiano Dominicano - DR TV,"Sintoniza La Voz de María en vivo, programación cristiana dominicana. Transmisión en vivo, sin cortes, directo desde República Dominicana.","La Voz de María transmite programación cristiana en vivo desde La Vega como estación católica de música: alabanza, mensajes y contenido familiar. Sintonízalo en cualquier momento del día directamente en DR TV.",hls,https://live.lavozdemaria.com:3436/live/lavozdemarialive.m3u8,https://lavozdemaria.org/,false
maquina-vision,Máquina Visión,regional,La Romana,"Máquina Visión en Vivo | TV de La Romana, RD - DR TV","Ve Máquina Visión en vivo, la señal digital de La Romana. Transmisión en vivo, sin cortes, directo desde República Dominicana.","Máquina Visión es la señal local de La Romana, llevando noticias, comunidad y programación regional a la pantalla. Para quienes son de La Romana —dentro o fuera del país— DR TV te conecta con tu canal en vivo, directo desde casa.",hls,https://vdopanel.jlahozconsulting.com:3303/hybrid/play.m3u8,https://makinavision.net/,false
tenarenses-tv,Tenarenses TV,regional,Tenares,"Tenarenses TV en Vivo | TV de Tenares, RD - DR TV","Ve Tenarenses TV en vivo, la señal digital de Tenares. Transmisión en vivo, sin cortes, directo desde República Dominicana.","Tenarenses TV es la señal local de Tenares, llevando noticias, comunidad y programación regional a la pantalla. Para quienes son de Tenares —dentro o fuera del país— DR TV te conecta con tu canal en vivo, directo desde casa.",youtube,youtube.com/@tenarensestv,https://www.tenarenses.com/tv-en-vivo/,false
telecontacto-canal-57,Telecontacto Canal 57,regional,Santiago de los Caballeros,"Telecontacto Canal 57 en Vivo | TV de Santiago de los Caballeros, RD - DR TV","Ve Telecontacto Canal 57 en vivo, la señal de Santiago de los Caballeros en República Dominicana. Transmisión en vivo, sin cortes, directo desde República Dominicana.","Telecontacto Canal 57 es la señal local de Santiago de los Caballeros, llevando noticias, comunidad y programación regional a la pantalla. Para quienes son de Santiago de los Caballeros —dentro o fuera del país— DR TV te conecta con tu canal en vivo, directo desde casa.",iframe,https://streaming.grupomediosdelnorte.com:2020/VideoPlayer/telecontacto?autoplay=1,https://telecontacto.tv/,false
