slug,name,category,province,seo_title,seo_description,channel_description,embed_type,embed_source,fallback_url,featured
cana-tv-digital,Cana TV Digital,regional,Veron,"Cana TV Digital en Vivo | TV de Veron, RD - DR TV","Ve Cana TV Digital en vivo, la señal de Veron en República Dominicana. Transmisión en vivo, sin cortes, directo desde República Dominicana.","Cana TV Digital es la señal local de Veron, llevando noticias, comunidad y programación regional a la pantalla. Para quienes son de Veron —dentro o fuera del país— DR TV te conecta con tu canal en vivo, directo desde casa.",hls,https://stream.hostuis.com:19360/canatvdigital/canatvdigital.m3u8,https://canatvdigital.com/,false
buena-tv,Buena TV,national-news,,Buena TV en Vivo Online | Noticias y TV Dominicana - DR TV,"Mira Buena TV en vivo online gratis, 24 horas al día. Transmisión en vivo, sin cortes, directo desde República Dominicana.","Buena TV es uno de los canales de referencia en Santo Domingo Este, con programación de noticias, opinión y actualidad dominicana. En DR TV puedes seguir su transmisión en vivo directamente, sin salir de la página, ya sea que estés en la isla o formes parte de la diáspora dominicana en el exterior.",hls,https://edge.essastream.com/buenatv/index.m3u8,https://dominicanchannels.com/buena-tv/,false
carivision,CariVisión,national-news,,CariVisión en Vivo Online | Noticias y TV Dominicana - DR TV,"Mira CariVisión en vivo online gratis, 24 horas al día. Transmisión en vivo, sin cortes, directo desde República Dominicana.","CariVisión es uno de los canales de referencia en Santo Domingo, con programación de noticias, opinión y actualidad dominicana. En DR TV puedes seguir su transmisión en vivo directamente, sin salir de la página, ya sea que estés en la isla o formes parte de la diáspora dominicana en el exterior.",youtube,youtube.com/channel/UCGo5FjcYI5fZszhfBUfcCgQ,http://carivision.online/,false
cdn-canal-37,CDN Canal 37,national-news,,CDN Canal 37 en Vivo | Noticias 24 Horas de República Dominicana - DR TV,"CDN Canal 37 en vivo: la cadena de noticias 24 horas de la República Dominicana con actualidad política, económica y social desde Santo Domingo.","CDN Canal 37 es la cadena de noticias 24 horas de referencia en la República Dominicana. Con sede en Santo Domingo y transmisión ininterrumpida, es el canal al que la audiencia dominicana suele acudir cuando ocurre una noticia de última hora, un evento político importante o una situación de emergencia nacional. Su programación combina noticieros a lo largo del día con espacios de análisis, entrevistas, debates económicos y coberturas especiales del acontecer dominicano y del Caribe.  Para la diáspora dominicana, CDN Canal 37 es una de las formas más directas de mantenerse al día con lo que pasa en la isla en tiempo real. Ya sea que vivas en Nueva York, Boston, Miami, Madrid o San Juan, sintonizar CDN en vivo es como abrir una ventana a la actualidad del país: el clima electoral, las decisiones del gobierno, la coyuntura económica y los debates sociales que marcan la conversación pública en la República Dominicana.  En DR TV puedes ver CDN Canal 37 directamente desde esta página, sin instalar aplicaciones ni crear cuentas. La señal se transmite en directo desde el propio sitio oficial de CDN, y desde nuestro directorio simplemente la mostramos junto al resto de canales dominicanos que emiten por internet. Es una de las mejores opciones para quienes quieren mantenerse informados de forma continua sobre la República Dominicana, en cualquier momento del día y desde cualquier parte del mundo con conexión.",youtube,youtube.com/channel/UCpFfLf9o4wJr-yr7dG8gYug,https://cdn.com.do/,false
canal-del-sol,Canal del Sol,entertainment,,Canal del Sol en Vivo Online | TV Dominicana Gratis - DR TV,"Disfruta Canal del Sol en vivo online, entretenimiento dominicano gratis. Transmisión en vivo, sin cortes, directo desde República Dominicana.","Canal del Sol transmite entretenimiento, variedades y programación familiar en vivo desde Santo Domingo. Una señal pensada para acompañarte todo el día, disponible en DR TV sin necesidad de buscar en otro sitio.",hls,https://stream.canaldelsol.com/sol26/master.m3u8,https://canaldelsol.com/,false
bonao-tv-canal-12,Bonao TV Canal 12,regional,Bonao Monseñor Nouel,Bonao TV Canal 12 en Vivo | DR TV,"Ve Bonao TV Canal 12 en vivo, la señal de Bonao Monseñor Nouel en República Dominicana. Transmisión en vivo, sin cortes, directo desde República Dominicana.","Bonao TV Canal 12 es la señal local de Bonao Monseñor Nouel, llevando noticias, comunidad y programación regional a la pantalla. Para quienes son de Bonao Monseñor Nouel —dentro o fuera del país— DR TV te conecta con tu canal en vivo, directo desde casa.",hls,https://tele-stream.telecasa.net/live/st2/bonaotv-hd/index.m3u8,https://www.bonaotv.com,false
boreal-television,Boreal Televisión,entertainment,,Boreal Televisión en Vivo Online | TV Dominicana Gratis - DR TV,"Disfruta Boreal Televisión en vivo online, entretenimiento dominicano gratis. Transmisión en vivo, sin cortes, directo desde República Dominicana.","Boreal Televisión transmite entretenimiento, variedades y programación familiar en vivo desde Santo Domingo. Una señal pensada para acompañarte todo el día, disponible en DR TV sin necesidad de buscar en otro sitio.",youtube,youtube.com/c/BOREALTELEVISI,https://borealtelevision.com/,false
acento-tv,Acento TV,national-news,,Acento TV en Vivo Online | Noticias y TV Dominicana - DR TV,"Mira Acento TV en vivo online gratis, 24 horas al día. Transmisión en vivo, sin cortes, directo desde República Dominicana.","Acento TV es uno de los canales de referencia en actualidad y opinión política dominicana, con programación de noticias, opinión y actualidad dominicana. En DR TV puedes seguir su transmisión en vivo directamente, sin salir de la página, ya sea que estés en la isla o formes parte de la diáspora dominicana en el exterior.",youtube,youtube.com/channel/UCxkjxuQjnsIBWErZ1tmQa3A,https://acentotv.acento.com.do/,false
cdn-deportes,CDN Deportes,sports,,CDN Deportes en Vivo | Deporte Dominicano y LIDOM - DR TV,"CDN Deportes en vivo: LIDOM, boxeo, béisbol invernal y actualidad del deporte dominicano transmitidos 24/7 desde Santo Domingo.","CDN Deportes es el brazo deportivo de la Cadena de Noticias (CDN) y una de las señales más seguidas por el aficionado dominicano al deporte. Desde Santo Domingo transmite la actualidad deportiva del país, con especial atención al béisbol invernal de LIDOM —la Liga Dominicana de Béisbol Invernal, corazón del deporte nacional entre octubre y enero— y a la Serie del Caribe cuando la representación dominicana está en juego.  Su programación cubre también boxeo, baloncesto, fútbol local, deportes de combate, resúmenes de la MLB con enfoque en los peloteros dominicanos, y programas de análisis y entrevistas con jugadores, dirigentes y periodistas del ambiente deportivo. Durante la temporada de LIDOM, CDN Deportes es una parada obligada para el fanático de Licey, Águilas Cibaeñas, Escogido, Estrellas Orientales, Toros del Este y Gigantes del Cibao —sobre todo para los dominicanos en el exterior que quieren seguir a su equipo desde Nueva York, Boston, Madrid o Puerto Rico.  Puedes ver CDN Deportes en vivo directamente en esta página de DR TV, con la señal servida desde el sitio oficial del canal. No hay que instalar aplicaciones ni crear cuentas: entras, y la señal está corriendo. Ideal para las noches de LIDOM, los sábados de boxeo o cualquier momento en que quieras estar al tanto de lo que está pasando en el deporte dominicano.",youtube,youtube.com/channel/UCDVgwGy7AbR9me7MJHpJ0zA,https://cdndeportes.com.do/,false
de-ultimo-minuto-tv,De Último Minuto TV,entertainment,,De Último Minuto TV en Vivo Online | TV Dominicana Gratis - DR TV,"Disfruta De Último Minuto TV en vivo online, entretenimiento dominicano gratis. Transmisión en vivo, sin cortes, directo desde República Dominicana.","De Último Minuto TV transmite entretenimiento, variedades y programación familiar en vivo desde Santo Domingo como parte de Alofoke Media Group. Una señal pensada para acompañarte todo el día, disponible en DR TV sin necesidad de buscar en otro sitio.",youtube,youtube.com/channel/UCyqn5zX5zoiD9VEKd6UvZrA,https://deultimominuto.net/de-ultimo-minuto-television/,false
bebeto-hd,Bebeto HD,entertainment,,Bebeto HD en Vivo Online | TV Dominicana Gratis - DR TV,"Disfruta Bebeto HD en vivo online, entretenimiento dominicano gratis. Transmisión en vivo, sin cortes, directo desde República Dominicana.","Bebeto HD transmite entretenimiento, variedades y programación familiar en vivo desde República Dominicana. Una señal pensada para acompañarte todo el día, disponible en DR TV sin necesidad de buscar en otro sitio.",youtube,youtube.com/@bebetotv1,https://bebetohd.com/,false
antena-canal-7,Antena Canal 7,national-news,,Antena Latina Canal 7 en Vivo | TV Dominicana Nacional - DR TV,"Antena Latina Canal 7 en vivo: noticias, variedades, novelas y programación familiar dominicana desde Santo Domingo, en directo 24 horas.","Antena Latina Canal 7 —conocido popularmente como Antena 7— es uno de los canales de televisión abierta más antiguos y establecidos de la República Dominicana. Con sede en Santo Domingo, forma parte del Grupo Corripio, uno de los conglomerados mediáticos más importantes del país, junto con Color Visión, Telesistema y Teleuniverso. Su parrilla combina noticieros, programas matutinos de opinión, espacios de variedades, novelas de la tarde, entretenimiento y programación familiar de fin de semana.  Para el público dominicano en la isla, Antena 7 es un canal de referencia para el informativo estelar de la noche y para los debates políticos y sociales que suelen marcar la conversación del día siguiente. Para la diáspora dominicana en Estados Unidos, España y Puerto Rico, verlo en directo es una manera de mantenerse conectado con el ritmo de la televisión nacional: los mismos programas, los mismos comerciales, la misma sensación de estar en casa aunque estés a miles de kilómetros.  En DR TV puedes seguir la transmisión en vivo de Antena Latina Canal 7 sin salir de esta página. La señal se emite desde el sitio oficial del canal y desde nuestro directorio se muestra al lado del resto de canales dominicanos, con un enlace de respaldo por si la señal principal falla y sugerencias de canales relacionados en la misma categoría de televisión nacional.",youtube,youtube.com/@antena7oficial,https://www.antena7.com.do/,false
bajo-techo-tv,Bajo Techo TV,entertainment,,Bajo Techo TV en Vivo Online | TV Dominicana Gratis - DR TV,"Disfruta Bajo Techo TV en vivo online, entretenimiento dominicano gratis. Transmisión en vivo, sin cortes, directo desde República Dominicana.","Bajo Techo TV transmite entretenimiento, variedades y programación familiar en vivo desde República Dominicana con enfoque en bienes raíces y estilo de vida. Una señal pensada para acompañarte todo el día, disponible en DR TV sin necesidad de buscar en otro sitio.",hls,https://cdnfox.hostlagarto.com/bajotechotv/index.m3u8,https://bajotecho.tv/,false
color-vision,Color Visión,national-news,,Color Visión Canal 9 en Vivo | TV Dominicana - DR TV,"Color Visión Canal 9 en vivo: uno de los canales más históricos de la televisión dominicana, con noticias, novelas, entretenimiento y programación familiar.","Color Visión Canal 9 es uno de los canales más históricos y reconocidos de la televisión abierta dominicana. Fundado en Santo Domingo hace más de medio siglo, forma parte del Grupo Corripio y desde su nacimiento se convirtió en una señal de referencia para la familia dominicana, con una parrilla que combina noticieros de la mañana y de la noche, programas de opinión, novelas latinoamericanas, producciones locales, espacios de variedades y programación deportiva puntual.  Para muchos dominicanos, Color Visión es ""el canal de siempre"": el que estaba encendido en casa a la hora del almuerzo, el que transmitió los eventos nacionales más importantes durante décadas, y el que hoy sigue siendo parte del ritual televisivo de millones de hogares en la isla. Para la diáspora dominicana en Nueva York, Boston, Miami, Madrid, San Juan o cualquier ciudad con presencia dominicana, poder ver Color Visión en vivo por internet es una forma directa de reencontrarse con el tono, la publicidad y el estilo de la televisión con la que muchos crecieron.  En DR TV puedes sintonizar la transmisión en directo de Color Visión Canal 9 desde esta misma página. La señal viene del sitio oficial del canal —nosotros nos limitamos a listarla junto al resto de la televisión dominicana—, así que basta con abrir la página para verla, sin instalar aplicaciones ni crear cuentas de usuario.",youtube,youtube.com/channel/UCiDATmLMS6XfkB7mh8pmeHg,https://colorvision.com.do/,false
hmtv-canal-33,HMTV Canal 33,regional,Hermanas Mirabal,"HMTV Canal 33 en Vivo | TV de Hermanas Mirabal, RD - DR TV","Ve HMTV Canal 33 en vivo, la señal de Hermanas Mirabal en República Dominicana. Transmisión en vivo, sin cortes, directo desde República Dominicana.","HMTV Canal 33 es la señal local de Hermanas Mirabal, llevando noticias, comunidad y programación regional a la pantalla. Para quienes son de Hermanas Mirabal —dentro o fuera del país— DR TV te conecta con tu canal en vivo, directo desde casa.",iframe,https://fox.hostlagarto.com/VideoPlayer/hmtv?autoplay=1,http://hmtv.com.do/,false
bellavision-canal-8,Bellavisión Canal 8,regional,Higüey,"Bellavisión Canal 8 en Vivo | TV de Higüey, RD - DR TV","Ve Bellavisión Canal 8 en vivo, la señal de Higüey en República Dominicana. Transmisión en vivo, sin cortes, directo desde República Dominicana.","Bellavisión Canal 8 es la señal local de Higüey, llevando noticias, comunidad y programación regional a la pantalla. Para quienes son de Higüey —dentro o fuera del país— DR TV te conecta con tu canal en vivo, directo desde casa.",iframe,https://fox.hostlagarto.com/VideoPlayer/bellavision8hd?autoplay=1,https://bellavision8.com/,false
larivision,Larivisión,regional,Barahona,"Larivisión en Vivo | TV de Barahona, RD - DR TV","Ve Larivisión en vivo, la señal de Barahona en República Dominicana. Transmisión en vivo, sin cortes, directo desde República Dominicana.","Larivisión es la señal local de Barahona, llevando noticias, comunidad y programación regional a la pantalla. Para quienes son de Barahona —dentro o fuera del país— DR TV te conecta con tu canal en vivo, directo desde casa.",hls,https://cloud5.larivision.net/hls/live.m3u8,https://www.larivision.com/,false
certv-canal-4,CERTV Canal 4,national-news,,CERTV Canal 4 (RTVD) en Vivo | Televisión Estatal Dominicana - DR TV,"CERTV Canal 4 / RTVD en vivo: la señal de la Corporación Estatal de Radio y Televisión, el canal público de la República Dominicana.","CERTV Canal 4 —también conocido como RTVD (Radio Televisión Dominicana)— es el canal público de la República Dominicana, operado por la Corporación Estatal de Radio y Televisión (CERTV). Con sede en Santo Domingo, es el medio oficial del Estado dominicano y una de las señales más antiguas de la televisión abierta del país, con presencia en todo el territorio nacional a través de repetidoras.  Su programación combina servicios informativos, cobertura de actos oficiales, sesiones del Congreso, eventos culturales y educativos, programación deportiva nacional, retransmisiones de festividades patronales y desfiles cívicos como el 27 de febrero, y espacios dedicados a la promoción del patrimonio cultural dominicano. Por ser el canal del Estado, suele ser la referencia principal cuando hay un mensaje presidencial, una emergencia nacional declarada o una jornada electoral en curso.  Para la diáspora dominicana, CERTV Canal 4 es también una fuente directa de contenido institucional del país: transmisiones oficiales del gobierno, cobertura de eventos culturales del Ministerio de Cultura y programación educativa. En DR TV puedes ver CERTV en directo desde esta misma página, con la señal servida desde el sistema de transmisión oficial de RTVD. No hace falta instalar nada ni crear una cuenta: la señal se muestra junto al resto de canales dominicanos disponibles en el directorio.",hls,https://protvradiostream.com:1936/canal4rd-1/ngrp:canal4rd-1_all/playlist.m3u8?DVR,https://rtvdclic.com/rtvd-en-vivo/,false
gh-television,GH Television,regional,Gaspar Hernandez,"GH Television en Vivo | TV de Gaspar Hernandez, RD - DR TV","Ve GH Television en vivo, la señal de Gaspar Hernandez en República Dominicana. Transmisión en vivo, sin cortes, directo desde República Dominicana.","GH Television es la señal local de Gaspar Hernandez, llevando noticias, comunidad y programación regional a la pantalla. Para quienes son de Gaspar Hernandez —dentro o fuera del país— DR TV te conecta con tu canal en vivo, directo desde casa.",hls,https://cdnfox.hostlagarto.com/ghtelevision/index.m3u8,https://ghtelevision.com/,false
linieros-tv,Linieros TV,regional,Dajabón border region,"Linieros TV en Vivo | TV de Dajabón border region, RD - DR TV","Ve Linieros TV en vivo, la señal de Dajabón border region en República Dominicana. Transmisión en vivo, sin cortes, directo desde República Dominicana.","Linieros TV es la señal local de Dajabón border region, llevando noticias, comunidad y programación regional a la pantalla. Para quienes son de Dajabón border region —dentro o fuera del país— DR TV te conecta con tu canal en vivo, directo desde casa.",youtube,youtube.com/@Linierosmedia,https://tv.linieros.com/,false
fuego-tv-canal-40,Fuego TV Canal 40,regional,Cienfuegos Santiago,"Fuego TV Canal 40 en Vivo | TV de Cienfuegos Santiago, RD - DR TV","Ve Fuego TV Canal 40 en vivo, la señal de Cienfuegos Santiago en República Dominicana. Transmisión en vivo, sin cortes, directo desde República Dominicana.","Fuego TV Canal 40 es la señal local de Cienfuegos Santiago, llevando noticias, comunidad y programación regional a la pantalla. Para quienes son de Cienfuegos Santiago —dentro o fuera del país— DR TV te conecta con tu canal en vivo, directo desde casa.",iframe,https://streamunoapp.com/broadcaster/cromtv/live/player,https://fuego40.com/,false
guaymate-tv,Guaymate TV,regional,La Romana,"Guaymate TV en Vivo | TV de La Romana, RD - DR TV","Ve Guaymate TV en vivo, la señal de La Romana en República Dominicana. Transmisión en vivo, sin cortes, directo desde República Dominicana.","Guaymate TV es la señal local de La Romana, llevando noticias, comunidad y programación regional a la pantalla. Para quienes son de La Romana —dentro o fuera del país— DR TV te conecta con tu canal en vivo, directo desde casa.",iframe,https://www.vivalivetv.com/embed?scheme=embedChannel&channelId=1807&autoplay=yes&showChat=no&theme=stormtrooper,https://www.vivalivetv.com/channel/guaymate-tv,false
digital-15,Digital 15,entertainment,,Digital 15 en Vivo Online | TV Dominicana Gratis - DR TV,"Disfruta Digital 15 en vivo online, entretenimiento dominicano gratis. Transmisión en vivo, sin cortes, directo desde República Dominicana.","Digital 15 transmite entretenimiento, variedades y programación familiar en vivo desde Santo Domingo como señal hermana de Telemicro. Una señal pensada para acompañarte todo el día, disponible en DR TV sin necesidad de buscar en otro sitio.",iframe,https://telemicro.com.do/players/15tv/index.php,https://telemicro.com.do/digital-15-en-vivo/,false
ready-tv-canal-6,Ready TV Canal 6,regional,La Vega,"Ready TV Canal 6 en Vivo | TV de La Vega, RD - DR TV","Ve Ready TV Canal 6 en vivo, la señal de La Vega en República Dominicana. Transmisión en vivo, sin cortes, directo desde República Dominicana.","Ready TV Canal 6 es la señal local de La Vega, llevando noticias, comunidad y programación regional a la pantalla. Para quienes son de La Vega —dentro o fuera del país— DR TV te conecta con tu canal en vivo, directo desde casa.",hls,https://streaming.telecablecentral.com.do/ReadyTV/ReadyHD/playlist.m3u8,https://readytelevision.com/en-vivo/,false
micro-vision,Micro Visión,regional,Central Cibao region (La Vega/Santiago/Duarte),Micro Visión en Vivo | DR TV,"Ve Micro Visión en vivo, la señal de Central Cibao region (La Vega/Santiago/Duarte) en República Dominicana. Transmisión en vivo, sin cortes, directo desde...","Micro Visión es la señal local de Central Cibao region (La Vega/Santiago/Duarte), llevando noticias, comunidad y programación regional a la pantalla. Para quienes son de Central Cibao region (La Vega/Santiago/Duarte) —dentro o fuera del país— DR TV te conecta con tu canal en vivo, directo desde casa.",youtube,youtube.com/embed/-G9Ms5p5P4Y,https://microvision.com.do/,false
caribbean-traveling-network-dominicano,Caribbean Traveling Network Dominicano,entertainment,,Caribbean Traveling Network Dominicano en Vivo | DR TV,"Disfruta Caribbean Traveling Network Dominicano en vivo online, entretenimiento dominicano gratis. Transmisión en vivo, sin cortes, directo desde República...","Caribbean Traveling Network Dominicano transmite entretenimiento, variedades y programación familiar en vivo desde República Dominicana con enfoque en turismo y viajes. Una señal pensada para acompañarte todo el día, disponible en DR TV sin necesidad de buscar en otro sitio.",youtube,youtube.com/@CTNDominicano,https://ctn.com.do/,false
maimon-tv-canal-3,Maimon TV Canal 3,regional,Maimon Bonao,"Maimon TV Canal 3 en Vivo | TV de Maimon Bonao, RD - DR TV","Ve Maimon TV Canal 3 en vivo, la señal de Maimon Bonao en República Dominicana. Transmisión en vivo, sin cortes, directo desde República Dominicana.","Maimon TV Canal 3 es la señal local de Maimon Bonao, llevando noticias, comunidad y programación regional a la pantalla. Para quienes son de Maimon Bonao —dentro o fuera del país— DR TV te conecta con tu canal en vivo, directo desde casa.",hls,https://tele-stream.telecasa.net/live/st3/maimontv-hd/index.m3u8,https://maimontv.com,false
luna-tv-canal-25,Luna TV Canal 25,regional,Santiago,"Luna TV Canal 25 en Vivo | TV de Santiago, RD - DR TV","Ve Luna TV Canal 25 en vivo, la señal de Santiago en República Dominicana. Transmisión en vivo, sin cortes, directo desde República Dominicana.","Luna TV Canal 25 es la señal local de Santiago, llevando noticias, comunidad y programación regional a la pantalla. Para quienes son de Santiago —dentro o fuera del país— DR TV te conecta con tu canal en vivo, directo desde casa.",hls,https://stream.lunatv.do/hls/prueba.m3u8,https://lunatvdigital.com/,false
supertv-55,Supertv 55,entertainment,,Supertv 55 en Vivo Online | TV Dominicana Gratis - DR TV,"Disfruta Supertv 55 en vivo online, entretenimiento dominicano gratis. Transmisión en vivo, sin cortes, directo desde República Dominicana.","Supertv 55 transmite entretenimiento, variedades y programación familiar en vivo desde República Dominicana. Una señal pensada para acompañarte todo el día, disponible en DR TV sin necesidad de buscar en otro sitio.",iframe,https://rdomiplayer.com/landing/tv/263/1,https://www.supertv55.tv/,false
reportero-tv,Reportero TV,regional,Las Matas de Santa Cruz Montecristi,Reportero TV en Vivo | DR TV,"Ve Reportero TV en vivo, la señal de Las Matas de Santa Cruz Montecristi en República Dominicana. Transmisión en vivo, sin cortes, directo desde República...","Reportero TV es la señal local de Las Matas de Santa Cruz Montecristi, llevando noticias, comunidad y programación regional a la pantalla. Para quienes son de Las Matas de Santa Cruz Montecristi —dentro o fuera del país— DR TV te conecta con tu canal en vivo, directo desde casa.",youtube,youtube.com/@Reportero46,https://reportero.com.do/,false
simavision-canal-18,SimaVisión Canal 18,regional,Villa Montellano Puerto Plata,SimaVisión Canal 18 en Vivo | DR TV,"Ve SimaVisión Canal 18 en vivo, la señal de Villa Montellano Puerto Plata en República Dominicana. Transmisión en vivo, sin cortes, directo desde República...","SimaVisión Canal 18 es la señal local de Villa Montellano Puerto Plata, llevando noticias, comunidad y programación regional a la pantalla. Para quienes son de Villa Montellano Puerto Plata —dentro o fuera del país— DR TV te conecta con tu canal en vivo, directo desde casa.",iframe,https://soportedvb.click/live-stream-video-widget/simavisiontv,https://simavision.tv/,false
mega-vision-43,Mega Vision 43,regional,Santiago,"Mega Vision 43 en Vivo | TV de Santiago, RD - DR TV","Ve Mega Vision 43 en vivo, la señal de Santiago en República Dominicana. Transmisión en vivo, sin cortes, directo desde República Dominicana.","Mega Vision 43 es la señal local de Santiago, llevando noticias, comunidad y programación regional a la pantalla. Para quienes son de Santiago —dentro o fuera del país— DR TV te conecta con tu canal en vivo, directo desde casa.",youtube,youtube.com/channel/UCchZNa11efTEhE4BOcqhfuw,https://www.megavisiontvrd.com/,false
romana-tv-canal-42,Romana TV Canal 42,regional,La Romana,"Romana TV Canal 42 en Vivo | TV de La Romana, RD - DR TV","Ve Romana TV Canal 42 en vivo, la señal de La Romana en República Dominicana. Transmisión en vivo, sin cortes, directo desde República Dominicana.","Romana TV Canal 42 es la señal local de La Romana, llevando noticias, comunidad y programación regional a la pantalla. Para quienes son de La Romana —dentro o fuera del país— DR TV te conecta con tu canal en vivo, directo desde casa.",hls,https://videoserver.tmcreativos.com:19360/cvmhbyrcat/cvmhbyrcat.m3u8,https://romanatv42.com/,false
