slug,name,category,province,seo_title,seo_description,channel_description,embed_type,embed_source,fallback_url,featured
tele-cotui-canal-10,Tele Cotuí Canal 10,regional,Cotui Sanchez Ramirez,Tele Cotuí Canal 10 en Vivo | DR TV,"Ve Tele Cotuí Canal 10 en vivo, la señal de Cotui Sanchez Ramirez en República Dominicana. Transmisión en vivo, sin cortes, directo desde República Dominicana.","Tele Cotuí Canal 10 es la señal local de Cotui Sanchez Ramirez, llevando noticias, comunidad y programación regional a la pantalla. Para quienes son de Cotui Sanchez Ramirez —dentro o fuera del país— DR TV te conecta con tu canal en vivo, directo desde casa.",youtube,youtube.com/embed/99yKmhwybKE,https://www.telecotuiglobal.com/,false
telemicro-canal-5,Telemicro Canal 5,national-news,,Telemicro Canal 5 en Vivo | TV Dominicana - DR TV,"Telemicro Canal 5 en vivo: variedades, novelas, deportes y programación familiar del Grupo Telemicro, desde Santo Domingo.","Telemicro Canal 5 es uno de los canales de televisión abierta más importantes de la República Dominicana. Con sede en Santo Domingo, es la señal principal del Grupo Telemicro, un conglomerado mediático que compite históricamente con el Grupo Corripio por la audiencia nacional y que engloba también otras señales, estaciones de radio y una infraestructura amplia de producción local.  La parrilla de Telemicro combina noticieros a lo largo del día, programas de variedades, novelas latinoamericanas de la tarde, contenido de entretenimiento familiar y transmisiones deportivas puntuales cuando el calendario nacional lo amerita. Es un canal fuertemente arraigado en el público dominicano de clase media y popular, y su presencia en televisores encendidos durante el día es una constante en muchos hogares de la isla.  Para la diáspora dominicana en Estados Unidos, España, Puerto Rico y otros países, ver Telemicro Canal 5 en vivo por internet es una manera directa de seguir el pulso de la televisión doméstica: novelas, tandas de variedades, informativos y anuncios comerciales que forman parte del paisaje cotidiano de la República Dominicana. En DR TV puedes sintonizar Telemicro directamente desde esta página, con la señal traída del sitio oficial del canal y presentada junto al resto del catálogo de televisión dominicana.",youtube,youtube.com/channel/UCAVnMMAcnwZ67RS6SQtvPOA,https://telemicro.com.do/telemicro-en-vivo/,false
telecentro-canal-13,Telecentro Canal 13,national-news,,Telecentro Canal 13 en Vivo | TV Nacional Dominicana - DR TV,"Telecentro Canal 13 en vivo: uno de los canales generalistas de la televisión dominicana, con noticieros, entretenimiento y programación de fin de semana.","Telecentro Canal 13 es uno de los canales generalistas de la televisión abierta dominicana con presencia consolidada en Santo Domingo y cobertura de alcance nacional. Su parrilla combina programas informativos, espacios de opinión y análisis, entretenimiento familiar, música dominicana, entrevistas y contenido de fin de semana orientado a variedades y espectáculos.  Por su enfoque generalista, Telecentro es un canal que se sintoniza tanto para estar al tanto de las noticias del día como para acompañar la tarde con contenido de entretenimiento. Es habitual encontrarlo encendido en negocios, colmados y salones de la casa dominicana durante la mañana, mientras que la noche suele dedicarse a informativos y programas de opinión. Para la diáspora dominicana, es una vía cercana para reencontrarse con el estilo de programación local: la voz de los presentadores dominicanos, el humor local, la publicidad familiar y la mezcla característica de la televisión de la isla.  En DR TV puedes ver la transmisión en vivo de Telecentro Canal 13 desde esta misma página, sin necesidad de instalar aplicaciones ni registrar una cuenta. La señal se muestra tal como la publica el canal en su sitio oficial y se presenta junto al resto de canales dominicanos organizados por categoría, con un enlace de respaldo y canales relacionados sugeridos debajo del reproductor.",youtube,youtube.com/channel/UCKd3RqAWndTIflbZGmIoYKw,https://telecentro.com.do/,false
telefuturo-canal-23,Telefuturo Canal 23,national-news,,Telefuturo Canal 23 en Vivo | RCC Televisión - DR TV,"Telefuturo Canal 23 en vivo: la señal del Grupo RCC en la República Dominicana, con noticias, variedades y programación familiar.","Telefuturo Canal 23 es la señal principal del Grupo RCC en la televisión abierta dominicana, con sede en Santo Domingo. RCC (Radio Cadena Comercial) es uno de los grupos de comunicación con más tradición en la República Dominicana, y Telefuturo funciona como su canal insignia, combinando informativos con programación de entretenimiento, variedades, opinión y contenido familiar.  Su parrilla incluye noticieros a lo largo del día, programas matutinos con entrevistas y análisis, contenido de tarde orientado al público general y espacios de entretenimiento nocturno. Es un canal fuertemente vinculado al ecosistema mediático dominicano por su relación con el grupo RCC Noticias, que también opera plataformas digitales y radio, permitiendo una cobertura de noticias con producción propia y equipos de reporteros en el terreno.  Para la diáspora dominicana en Nueva York, Boston, Miami, Madrid y otros centros de población dominicana en el exterior, Telefuturo es una de las señales accesibles por internet para seguir la actualidad y la programación de entretenimiento del país. En DR TV puedes verlo en vivo desde esta misma página, con la transmisión servida desde el sitio oficial del grupo RCC. No hay que instalar aplicaciones, no hay que crear cuentas, no hay que pagar suscripciones: la señal se muestra junto al resto de la televisión dominicana del directorio.",youtube,youtube.com/@RCCMEDIA,https://rccnoticias.com.do/rcc-tv/,false
tele-radio-norte,Tele Radio Norte,national-news,,Tele Radio Norte en Vivo | DR TV,"Mira Tele Radio Norte en vivo online gratis, 24 horas al día. Transmisión en vivo, sin cortes, directo desde República Dominicana.","Tele Radio Norte es uno de los canales de referencia con música y películas dominicanas, con programación de noticias, opinión y actualidad dominicana. En DR TV puedes seguir su transmisión en vivo directamente, sin salir de la página, ya sea que estés en la isla o formes parte de la diáspora dominicana en el exterior.",hls,https://angelistic.live:3785/hybrid/play.m3u8,https://teleradionorte.com/,false
tele-dominicana,Tele Dominicana,national-news,,Tele Dominicana en Vivo Online | Noticias y TV Dominicana - DR TV,"Mira Tele Dominicana en vivo online gratis, 24 horas al día. Transmisión en vivo, sin cortes, directo desde República Dominicana.","Tele Dominicana es uno de los canales de referencia en Santo Domingo Este, con programación de noticias, opinión y actualidad dominicana. En DR TV puedes seguir su transmisión en vivo directamente, sin salir de la página, ya sea que estés en la isla o formes parte de la diáspora dominicana en el exterior.",hls,https://vdopanel.jlahozconsulting.com:3772/multi_live/play_720.m3u8,https://teledominicana.net/,false
teleantillas,Teleantillas,national-news,,Teleantillas en Vivo | TV Dominicana Nacional - DR TV,"Teleantillas en vivo: uno de los canales históricos de la televisión abierta dominicana, con noticias, entretenimiento y programación familiar.","Teleantillas es uno de los canales históricos de la televisión abierta de la República Dominicana, con presencia consolidada en Santo Domingo y cobertura de alcance nacional. Durante décadas ha sido parte del ecosistema mediático dominicano, con una parrilla generalista que combina noticieros, programas de opinión política, contenido de entretenimiento, novelas, variedades y programación familiar de fin de semana.  Es un canal de referencia para audiencias que buscan el estilo clásico de la televisión dominicana: informativos matutinos, mediodía de variedades, tandas de novela por la tarde y noticiero estelar por la noche. Su presencia en la vida cotidiana del televidente dominicano se sostiene por la combinación de producción local y programas licenciados de la región.  Para la diáspora dominicana, ver Teleantillas en vivo desde el exterior es una manera de mantener el contacto con la televisión con la que muchos crecieron —los mismos rostros, el mismo tono, la misma mezcla de contenido nacional e internacional que se ve en la República Dominicana. En DR TV puedes seguir la transmisión en directo de Teleantillas desde esta misma página, sin necesidad de instalar aplicaciones ni registrarte. La señal se emite desde su canal oficial y desde nuestro directorio se presenta junto al resto de canales dominicanos, con un enlace de respaldo por si la señal principal falla y sugerencias de canales relacionados en la categoría de televisión nacional.",youtube,youtube.com/@teleantillas10,https://teleantillas.com.do/,false
mia-vision-canal-97,Mia Visión Canal 97,regional,Puerto Plata,Mia Visión Canal 97 en Vivo | TV de Puerto Plata - DR TV,"Mia Visión Canal 97 en vivo: la señal comunitaria y cultural de Puerto Plata, en la costa norte de la República Dominicana.","Mia Visión Canal 97 es una de las señales comunitarias más activas de Puerto Plata, en la costa norte de la República Dominicana. Puerto Plata es una de las provincias con mayor peso histórico y cultural del país —cuna de la música merengue típica, puerta de entrada del turismo internacional y sede de una identidad regional muy marcada—, y Mia Visión funciona como una de sus voces televisivas de referencia.  La programación combina información local, cobertura de actos comunitarios, actividades culturales, entrevistas con figuras de la vida pública puertoplateña, contenido religioso, música dominicana y espacios de opinión sobre lo que pasa en la provincia. Para quienes viven en San Felipe de Puerto Plata, Sosúa, Cabarete, Villa Montellano o el resto de los municipios de la provincia, es una fuente cercana de información sobre lo que ocurre en la calle, en el ayuntamiento y en las comunidades vecinas.  Para la diáspora puertoplateña en Nueva York, Nueva Jersey y otras ciudades estadounidenses con presencia dominicana significativa, Mia Visión es una manera de seguir conectado con el pulso de la provincia natal: las fiestas patronales, los eventos culturales, las noticias locales y las voces conocidas del pueblo. En DR TV puedes ver Mia Visión Canal 97 en directo desde esta misma página, sin instalar aplicaciones ni crear cuentas, junto al resto de canales dominicanos organizados por región.",youtube,youtube.com/@miavisiontv8372,https://miavision.tv/,false
teleradio-america,Teleradio América,national-news,,Teleradio América en Vivo | TV Dominicana - DR TV,"Teleradio América en vivo: la señal del Grupo América con transmisión simultánea de televisión, radio e internet desde Santo Domingo.","Teleradio América es la señal televisiva del Grupo América, con sede en Santo Domingo, y una particularidad que la distingue en el panorama mediático dominicano: emite en simultáneo por televisión abierta, radio e internet, permitiendo que buena parte de su programación se consuma indistintamente por cualquiera de los tres canales. Esta estructura simulcast es especialmente útil para la audiencia que combina consumo doméstico (TV en casa), consumo móvil (radio en el vehículo) y consumo digital (streaming desde el trabajo o el extranjero).  Su parrilla combina programas de opinión política, informativos, magazines de actualidad, contenido cultural y música dominicana. Es un canal con estilo editorial reconocible dentro del ecosistema de medios de la República Dominicana, con presencia frecuente en la conversación política del país y con seguimiento consolidado por parte del público interesado en el análisis coyuntural.  Para la diáspora dominicana, la naturaleza multi-plataforma de Teleradio América es una ventaja: puedes ver la señal de televisión por internet desde el exterior aunque no tengas acceso al espectro abierto local. En DR TV encontrarás la transmisión en vivo de Teleradio América disponible desde esta misma página, servida desde su portal oficial y organizada junto al resto de canales nacionales de nuestro directorio.",youtube,youtube.com/@canaltrard,https://teleradioamerica.com/envivo/,false
teleimpacto,Teleimpacto,national-news,,Teleimpacto en Vivo Online | Noticias y TV Dominicana - DR TV,"Mira Teleimpacto en vivo online gratis, 24 horas al día. Transmisión en vivo, sin cortes, directo desde República Dominicana.","Teleimpacto es uno de los canales de referencia en actualidad y opinión política dominicana, con programación de noticias, opinión y actualidad dominicana. En DR TV puedes seguir su transmisión en vivo directamente, sin salir de la página, ya sea que estés en la isla o formes parte de la diáspora dominicana en el exterior.",iframe,https://vpss2003.streamprolive.com/i/cp/html5player.html,https://teleimpacto52.com.do/,false
teleuniverso-canal-29,Teleuniverso Canal 29,national-news,,Teleuniverso Canal 29 en Vivo | TV Dominicana - DR TV,"Teleuniverso Canal 29 en vivo: la señal del Grupo Corripio con programación de entretenimiento, variedades y contenido familiar dominicano.","Teleuniverso Canal 29 es una de las señales del Grupo Corripio, el conglomerado mediático que engloba también a Color Visión, Telesistema y Antena Latina, entre otros. Con sede en Santo Domingo, Teleuniverso complementa las señales principales del grupo con una parrilla orientada al entretenimiento, las variedades, la música dominicana e internacional, contenido cultural y programación familiar de fin de semana.  Su estilo es más ligero que el de los canales insignia del grupo: mientras que los otros tienden a un balance entre noticieros y entretenimiento, Teleuniverso suele enfocarse más en el acompañamiento a lo largo del día, con programas de música, magazines, entrevistas de espectáculos y contenido variado que funciona como televisión de fondo en muchos hogares y comercios de la República Dominicana. Es también un espacio donde suelen surgir producciones jóvenes y propuestas locales que buscan audiencia dentro de la infraestructura del Grupo Corripio.  Para la diáspora dominicana, Teleuniverso Canal 29 es una manera de acceder a la programación más liviana y de entretenimiento de la televisión nacional, sin los tiempos informativos densos, y con música dominicana que muchas veces solo se escucha con esta frecuencia en la propia isla. En DR TV puedes ver Teleuniverso en directo desde esta página, con la señal traída del sitio oficial del canal.",youtube,youtube.com/@CanalTeleuniverso,https://teleuniversotv.com/,false
teleunion-canal-16,Teleunión Canal 16,regional,Santiago,"Teleunión Canal 16 en Vivo | TV de Santiago, RD - DR TV","Ve Teleunión Canal 16 en vivo, la señal de Santiago en República Dominicana. Transmisión en vivo, sin cortes, directo desde República Dominicana.","Teleunión Canal 16 es la señal local de Santiago, llevando noticias, comunidad y programación regional a la pantalla. Para quienes son de Santiago —dentro o fuera del país— DR TV te conecta con tu canal en vivo, directo desde casa.",hls,https://68aff552e1684.streamlock.net/teleunion/TU/playlist.m3u8,https://teleuniontvrd.com/,false
r-e-television,R&E Televisión,regional,Comendador Elías Piña,"R&E Televisión en Vivo | TV de Comendador Elías Piña, RD - DR TV","Ve R&E Televisión en vivo, la señal de Comendador Elías Piña en República Dominicana. Transmisión en vivo, sin cortes, directo desde República Dominicana.","R&E Televisión es la señal local de Comendador Elías Piña, llevando noticias, comunidad y programación regional a la pantalla. Para quienes son de Comendador Elías Piña —dentro o fuera del país— DR TV te conecta con tu canal en vivo, directo desde casa.",hls,https://cloud2.streaminglivehd.com:1936/8072/8072/playlist.m3u8,https://retv.do/en-vivo/,false
telenord-canal-8,Telenord Canal 8,regional,San Francisco de Macoris,Telenord Canal 8 en Vivo | DR TV,"Ve Telenord Canal 8 en vivo, la señal de San Francisco de Macoris en República Dominicana. Transmisión en vivo, sin cortes, directo desde República Dominicana.","Telenord Canal 8 es la señal local de San Francisco de Macoris, llevando noticias, comunidad y programación regional a la pantalla. Para quienes son de San Francisco de Macoris —dentro o fuera del país— DR TV te conecta con tu canal en vivo, directo desde casa.",youtube,youtube.com/channel/UCCfVdftz7iAug_IYreoJgHw,https://telenord.com.do/index.php?option=com_content&view=featured&Itemid=115,false
tele-santo-domingo,Tele Santo Domingo,national-news,,Tele Santo Domingo en Vivo | DR TV,"Mira Tele Santo Domingo en vivo online gratis, 24 horas al día. Transmisión en vivo, sin cortes, directo desde República Dominicana.","Tele Santo Domingo es uno de los canales de referencia como Canal 42 de la cablera Éxito Visión, con programación de noticias, opinión y actualidad dominicana. En DR TV puedes seguir su transmisión en vivo directamente, sin salir de la página, ya sea que estés en la isla o formes parte de la diáspora dominicana en el exterior.",hls,https://vdopanel.jlahozconsulting.com:3769/live/santodomingolive.m3u8,https://www.telesantodomingo.com/,false
telenord-canal-12,Telenord Canal 12,national-news,,Telenord Canal 12 en Vivo | DR TV,"Mira Telenord Canal 12 en vivo online gratis, 24 horas al día. Transmisión en vivo, sin cortes, directo desde República Dominicana.","Telenord Canal 12 es uno de los canales de referencia como parte de la red Telenord, con programación de noticias, opinión y actualidad dominicana. En DR TV puedes seguir su transmisión en vivo directamente, sin salir de la página, ya sea que estés en la isla o formes parte de la diáspora dominicana en el exterior.",youtube,youtube.com/channel/UCCfVdftz7iAug_IYreoJgHw,https://telenord.com.do/index.php?option=com_content&view=featured&Itemid=117,false
punta-cana-tv,Punta Cana TV,regional,Punta Cana,"Punta Cana TV en Vivo | TV de Punta Cana, RD - DR TV","Ve Punta Cana TV en vivo, la señal de Punta Cana en República Dominicana. Transmisión en vivo, sin cortes, directo desde República Dominicana.","Punta Cana TV es la señal local de Punta Cana, llevando noticias, comunidad y programación regional a la pantalla. Para quienes son de Punta Cana —dentro o fuera del país— DR TV te conecta con tu canal en vivo, directo desde casa.",youtube,youtube.com/@puntacanatv,https://puntacanatvrd.com/web/,false
telesistema-canal-11,Telesistema Canal 11,national-news,,Telesistema Canal 11 en Vivo | TV Dominicana - DR TV,"Telesistema Canal 11 en vivo: uno de los canales insignia del Grupo Corripio, con noticias, variedades y entretenimiento familiar dominicano.","Telesistema Canal 11 es uno de los canales insignia del Grupo Corripio en la televisión abierta dominicana. Con sede en Santo Domingo, comparte casa con Color Visión, Teleuniverso y Antena Latina dentro del mismo conglomerado, y funciona como una de las señales generalistas más establecidas del país. Su parrilla combina noticieros a lo largo del día, programas matutinos de gran audiencia, espacios de mediodía dedicados a variedades y música dominicana, novelas de la tarde, y contenido de entretenimiento familiar por la noche.  Es un canal de referencia para el público dominicano de clase media y popular, presente en muchos hogares como parte de la rutina del día: café con el matutino, almuerzo con el mediodía, cena con el noticiero estelar. Su estilo editorial es reconocible por generaciones de televidentes dominicanos y forma parte de la identidad de la televisión abierta del país junto a los otros canales grandes de Santo Domingo.  Para la diáspora dominicana en Nueva York, Nueva Jersey, Massachusetts, Florida, Puerto Rico, España y otras regiones con presencia dominicana significativa, ver Telesistema Canal 11 en vivo por internet es una manera directa de mantenerse en sintonía con la televisión de casa: los mismos programas, los mismos horarios, las mismas voces. En DR TV la señal está disponible en directo desde esta misma página, servida desde el portal oficial del canal y listada junto al resto del directorio de televisión dominicana.",youtube,youtube.com/c/telesistema11rd,https://telesistema11.com.do/,false
tv-higuey-digital,TV Higüey Digital,regional,Altagracia/Higüey,"TV Higüey Digital en Vivo | TV de Altagracia/Higüey, RD - DR TV","Ve TV Higüey Digital en vivo, la señal de Altagracia/Higüey en República Dominicana. Transmisión en vivo, sin cortes, directo desde República Dominicana.","TV Higüey Digital es la señal local de Altagracia/Higüey, llevando noticias, comunidad y programación regional a la pantalla. Para quienes son de Altagracia/Higüey —dentro o fuera del país— DR TV te conecta con tu canal en vivo, directo desde casa.",youtube,youtube.com/channel/UC3elUUXf0hQ6ay_ABawSM7Q,https://tvhigueydigital.com/,false
televiaducto,Televiaducto,regional,Moca Channel 3,"Televiaducto en Vivo | TV de Moca Channel 3, RD - DR TV","Ve Televiaducto en vivo, la señal de Moca Channel 3 en República Dominicana. Transmisión en vivo, sin cortes, directo desde República Dominicana.","Televiaducto es la señal local de Moca Channel 3, llevando noticias, comunidad y programación regional a la pantalla. Para quienes son de Moca Channel 3 —dentro o fuera del país— DR TV te conecta con tu canal en vivo, directo desde casa.",youtube,youtube.com/channel/UCuJT7sicnhl0wkw9L4_j92w,https://www.televiaducto.com.do/,false
television-dominicana-usa,Televisión Dominicana (USA),national-news,,Televisión Dominicana (USA) en Vivo | Canal de la Diáspora Dominicana - DR TV,"Televisión Dominicana en vivo desde Estados Unidos: la señal pensada para la diáspora dominicana en Nueva York, Nueva Jersey y todo el país.","Televisión Dominicana (USA) es la señal producida y distribuida principalmente para la diáspora dominicana en Estados Unidos. Nacida para atender a la enorme comunidad dominicana radicada en Nueva York, Nueva Jersey, Massachusetts, Florida y el resto del país, su programación mezcla contenido producido directamente en Estados Unidos —dirigido al inmigrante dominicano y sus hijos— con retransmisiones y coproducciones vinculadas a la programación de la República Dominicana.  Su parrilla habitual incluye programas de opinión y análisis de la actualidad dominicana desde una mirada de diáspora, música dominicana (merengue, bachata, dembow, típico), farándula, entrevistas con figuras dominicanas radicadas en Estados Unidos, contenido comunitario sobre la vida del dominicano-americano y espacios dedicados a las provincias de origen de la mayoría de la diáspora, como Santiago, La Vega, Puerto Plata, San Francisco de Macorís o Baní.  Es un canal especialmente relevante para las segundas generaciones —dominicanos nacidos en Estados Unidos que quieren reconectar con la cultura del país de sus padres— y para los recién llegados que buscan referentes conocidos en su primer año en el exterior. En DR TV puedes ver Televisión Dominicana (USA) en vivo desde esta misma página, sin instalar aplicaciones, sin crear cuentas y sin depender de canales de YouTube inestables. Es uno de los canales destacados de nuestro directorio precisamente por el valor que aporta a la audiencia diaspórica.",youtube,youtube.com/@televisiondominicanatv5145,https://www.televisiondominicana.tv/,true
tv-10-san-juan,TV 10 San Juan,regional,San Juan de la Maguana,"TV 10 San Juan en Vivo | TV de San Juan de la Maguana, RD - DR TV","Ve TV 10 San Juan en vivo, la señal de San Juan de la Maguana en República Dominicana. Transmisión en vivo, sin cortes, directo desde República Dominicana.","TV 10 San Juan es la señal local de San Juan de la Maguana, llevando noticias, comunidad y programación regional a la pantalla. Para quienes son de San Juan de la Maguana —dentro o fuera del país— DR TV te conecta con tu canal en vivo, directo desde casa.",hls,https://59d39900ebfb8.streamlock.net:443/tv10sanjuan/tv10sanjuan/playlist.m3u8,https://tv10sanjuan.com.do/,false
tv-plata,TV Plata,regional,Puerto Plata,"TV Plata en Vivo | TV de Puerto Plata, RD - DR TV","Ve TV Plata en vivo, la señal de Puerto Plata en República Dominicana. Transmisión en vivo, sin cortes, directo desde República Dominicana.","TV Plata es la señal local de Puerto Plata, llevando noticias, comunidad y programación regional a la pantalla. Para quienes son de Puerto Plata —dentro o fuera del país— DR TV te conecta con tu canal en vivo, directo desde casa.",iframe,https://rdomiplayer.com/landing/tv/1075/1,https://tvplata.com/,false
tvs,TVS,regional,Tenares Hermanas Mirabal,"TVS en Vivo | TV de Tenares Hermanas Mirabal, RD - DR TV","Ve TVS en vivo, la señal de Tenares Hermanas Mirabal en República Dominicana. Transmisión en vivo, sin cortes, directo desde República Dominicana.","TVS es la señal local de Tenares Hermanas Mirabal, llevando noticias, comunidad y programación regional a la pantalla. Para quienes son de Tenares Hermanas Mirabal —dentro o fuera del país— DR TV te conecta con tu canal en vivo, directo desde casa.",youtube,youtube.com/@tvscanal2295,https://tvs.com.do/,false
